Author,Subreddit,Date,Title,Post
ka-wei,MachineLearning,1618776983.0,[P] Cinemate - Movie Recommender System made with Tensorflow Rust,for last coupl month i work movi recommend system use tensorflow rust the model use collabor filter neural network recommend movi base movi input unlik model find internet model also take rate popular trade coeffici input if prefer popular movi coeffici set nmbr valu high averag rate coeffici set nmbr the optim number probabl two default valu nmbr a big goal websit fast recommend get recommend matter second due perform highli optim predict rust you visit websit http cinem http cinem
NoAnalyst4,MachineLearning,1620067314.0,[D] Does the ICML acceptance rate curtailment impact 2021 submissions?,are new icml accept rule appli year paper next year submiss thi first ever submiss icml i worri chanc chang announc http www reddit com r machinelearn comment nnmbrqw _icml _confer _we _plan _to _reduc _the _number _of http www reddit com r machinelearn comment nnmbrqw d_icml_conference_we_plan_to_reduce_the_number_of i bias seem realli unfair chang polici middl decis process
Yuqing7,MachineLearning,1619109567.0,[R] Are Multilingual Language Models Fragile? IBM Adversarial Attack Strategies Cut MBERT QA Performance by 85%,an ibm research team propos four multilingu adversari attack strategi attack seven languag zero shot set larg multilingu pretrain languag model e g mbert reduc averag perform nmbr percent here quick read are multilingu languag model fragil ibm adversari attack strategi cut mbert qa perform nmbr http syncedreview com nmbr nmbr nmbr deepmind podrac tpu base rl framework deliv except perform low cost nmbr the paper are multilingu bert model robust a case studi adversari attack multilingu question answer arxiv http arxiv org pdf nmbr pdf
hardmaru,MachineLearning,1617623139.0,[R] Towards General Purpose Vision Systems,
Superb-Drawer5214,MachineLearning,1617340770.0,[D] How important is the prestige of undergraduate school in getting into top ML PhD programs?,i look cv resum phd student cmu berkeley stanford univers washington mit got bachelor degre berkeley stanford mit cmu harvard princeton iit there student graduat famou ivi leagu school univers washington peke tsinghua i could view cv resum upload cv i consid attend umd three student graduat umd phd school
byronbae,MachineLearning,1616680571.0,[P] Sound pollution mapping from GeoJSON,i undertak data scienc project within job subject unfamiliar there alreadi big problem extrem data scarciti asid i wonder anyon could help start point to put simpli possibl i geojson file contain sound measur specif coordin throughout citi i would like build model tri predict noisiest point eventu goal would includ type relat data real time traffic etc etc for i found seem closest problem http omdena com heatmap machin learn it go concept actual appli technolog etc idea type data outcom similar goal i play around data bit alreadi notebook leaflet arcqgi bit issu wrap head around entir workflow project could work sinc i want go map raw data point map key point identifi analysi point ani insight would greatli appreci
Ekkolo,MachineLearning,1620631488.0,[D] NER for Resume Parsing,hello i need resum pars french resum i use prodigi prodi gy http prodi gy annot dataset make model my question better annot full resum annot line line posit text full document inform mayb spaci care thank
Acrobatic-Egg-,MachineLearning,1619433901.0,[D] The Journey Of Problem-Solving Using Analytics,in nmbr year work analyt domain fortun nmbr client across geographi one thing i realiz peopl may solv busi problem use analyt journey lost somewher at risk sound clich enjoy journey destin so attempt creat problem solv journey i experienc learn fail the framework problem solv use analyt nmbr step process on go nmbr break busi problem analyt problem let start anoth clich if i hour solv problem i spend nmbr minut think problem nmbr minut think solut thi lot analyst consult fail as soon busi problem fall ear straightaway get solut ing without even bare attempt understand problem hand to tackl i team follow call cs fs framework extra mark come better name the cs fs framework stand current state futur state framework in cs fs framework first step identifi current state client current problem follow next step identifi desir futur state want solut provid insight behavior driven insight final outcom driven behavior the final import step cs fs framework identifi gap prevent client move current state desir futur state thi becom analyt problem thu input next step nmbr find analyt solut analyt problem now busi problem convert analyt problem let look data shall a big no we start form hypothes around problem without be bias by the data i stress point enough the process form hypothes independ data avail the correct method form possibl hypothes look avail data elimin hypothes data after hypothes form start look data usual analyt solut follow understand data eda test hypothes ml problem requir yada yada yada thi part analyst good for exampl problem revolv around custom churn step go ahead classif model let remind output step analyt solut classif model custom churn problem most time peopl solv problem would technic gift understand confus matrix output classif model output auc roc curv they want talk languag understand thi take final road journey problem solv final step nmbr convert analyt solut busi solut an analyt solut comput busi solut human and less deal human want understand mani week worth effort produc you may creat effici accur ml model world ever seen final stakehold unabl interpret mean whole exercis useless thi use stori board experi actual tell stori would start current state problem step taken reach desir futur state thi visual skill dashboard creation insight gener creation deck come pictur again creat dashboard report keep mind tell stori lay beauti color chart power bi tableau dashboard each chart number report action orient part larger stori onli someon understand stori like go purchas anoth book onli make journey beauti meaning fellow passeng stakehold travel with said i reach destin i hope i total open critic suggest improv i make journey look forward input commun
SimlaBurcu,MachineLearning,1619032775.0,[P] ColTraIn Hybrid Block Floating-Point (HBFP) Training Emulator,we excit announc releas coltrain hbfp train emul http github com parsa epfl hbfpemul hbfp http paper nip cc paper nmbr file nmbranmbraeddfcnmbrcnmbrdnmbrenmbrbnmbrcccnmbrabnmbrbcnmbr paper pdf offer accuraci nmbr bit float point numer silicon densiti nmbr bit fix point wide varieti model resnet wideresnet densenet alexnet lstm bert we forese hbfp lay foundat accur train algorithm run acceler order magnitud denser arithmet convent novel float point base platform the coltrain emul repositori includ sever exampl dnn model includ cnn lstm bert hbfp refer fpnmbr baselin check coltrain emul http github com parsa epfl hbfpemul http github com parsa epfl hbfpemul visit websit http parsa epfl ch coltrain http parsa epfl ch coltrain inform
hardmaru,MachineLearning,1618498632.0,[R] Meta-Learning Bidirectional Update Rules. A new type of generalized neural net where neurons and synapses maintain multiple states. They show that backprop in classical neural nets can be seen as a special case of a two-state net where one state is used for activations and another for gradients.,
Svito-zar,MachineLearning,1617024327.0,[D] Is anyone using Automatic Bug Fixing Tools for Python?,mani us make bug some often i one after fix bug sever month screw mani experi i wonder ml find bug quick search topic result mani paper even tool http analyticsindiamag com nmbr python bug fix tool essenti develop http analyticsindiamag com nmbr python bug fix tool essenti develop and i wonder anyon use tool are actual work can fix copi past error
mrgemy95,MachineLearning,1620443257.0,[D] JAX vs Pytorch gpu performance.,doe anyon know benchmark compar jax api pytorch speed gpu i awar comparison http dzone com articl acceler automat differenti jax http dzone com articl acceler automat differenti jax compar desn lay i look someth benchmark complic architectur
projekt_treadstone,MachineLearning,1619738644.0,[D] Prototypical network in the medical domain,is exist project work implement prototyp network base meta learn medic imag as medic imag heavier load comput imagenet i would like know handl larg pixel medic data as i resiz larg medic imag per standard prototyp architectur larg drop accuraci with larg resiz valu fit gpu train
hardmaru,MachineLearning,1616865606.0,[R] Out of Distribution Generalization in Machine Learning (Martin Arjovsky's PhD Thesis),
PebbleWrestler9000,MachineLearning,1617831182.0,[D] Issues with using LSTM networks to classify raw EMG signal data,i unsur correct subreddit post i current issu ml undergradu research project i hope potenti get guidanc my current task take emg signal data time domain electr signal data gather user classifi finger person engag moment thi multi class label classif problem nmbr total label possibl thi exampl emg signal look like plot python http preview redd ggednmbrotfgtrnmbr png width nmbr format png auto webp fafnmbrdnmbrfnmbrdnmbrdcbddnmbrddnmbrfnmbrenmbrcenmbrb as tell graph i normal amplitud rang rang nmbr nmbr ensur time seri equal length i append nmbr front end seri match length longest sequenc data set as result time seri approxim length nmbr nmbr total seri the distribut label approxim equal the result tensor shape nmbr nmbr nmbr nmbr row nmbr length sequenc nmbr valu store time step i current use follow kera model http preview redd frrnmbrcnbygtrnmbr png width nmbr format png auto webp anmbrenmbrfnmbrefeadenmbrbcnmbrabbnmbranmbrdcnmbrc i use lstm network length sequenc number neuron follow dropout follow dens layer anoth dropout layer final classif dens layer i use adam optim algorithm learn rate nmbre nmbr nmbre nmbr i also tweak lnmbr kernel regular valu default rang nmbre nmbr nmbre nmbr my issu i unusu terribl perform exampl http preview redd nmbresbnmbrphtrnmbr png width nmbr format png auto webp cfnmbrfnmbrcanmbrenmbrcnmbranmbrecaanmbranmbrfcnmbra the valid accuraci consist zero valid loss continu increas fit train accuraci plateau around valu nmbr i run model nmbr epoch valid accuraci nonetheless remain nmbr loss increas the train accuraci loss continu plateau even nmbr epoch i initi suspect overfit could issu deal dropout layer i believ case would anyon chat help figur go model simpli learn thank
hardmaru,MachineLearning,1617937116.0,[P] Neuralink's Monkey Mindpong,blog post http neuralink com blog their decod presum train machin learn take neural activ data monkey calibr enabl monkey play pong directli thought
Jack_Hackerman,MachineLearning,1618764770.0,[D] How to normalize and merge two different datasets with similar deltas for Keras?,hi i get enough attent stackoverflow ask i two dataset train model the first dataset valu within rang nmbr nmbr anoth one nmbr nmbr rang essenti dataset similar sens percentag data chang so nmbr data chang rownmbr valuenmbr nmbr rownmbr valuenmbr nmbr first dataset anoth dataset someth like rownmbr valuenmbr nmbr rownmbr valuenmbr nmbr raw valu rang target differ similar percentag chang nmbr how i normal make similar combin break network nmbr is possibl nmbr should i normal target should i normal data i feed predict function i tri predict stock someth data financi data need job make regress bond paramet updat i realiz i normal first second dataset separ use set mean set std lol i target what one target nmbr anoth target nmbr
Yuqing7,MachineLearning,1617896959.0,[N] ContinualAI Releases Avalanche: An End-to-End Library for Continual Learning,a research develop team continualai includ larg group research ku leuven byted ai lab univers california new york univers institut propos avalanch end end librari continu learn base pytorch here quick read continualai releas avalanch an end end librari continu learn http syncedreview com nmbr nmbr nmbr continualai releas avalanch end end librari continu learn the paper avalanch end end librari continu learn arxiv http arxiv org pdf nmbr pdf
thedeepreader,MachineLearning,1620224443.0,[D] (Paper Overview) MLP-Mixer: An all-MLP Architecture for Vision,video http youtu nmbrfhmzebnzro http youtu nmbrfhmzebnzro paper http arxiv org ab nmbr http arxiv org ab nmbr code will soon avail author http github com googl research vision _transform http github com googl research vision_transform abstract convolut neural network cnn go model comput vision recent attent base network vision transform also becom popular in paper show convolut attent suffici good perform neither necessari we present mlp mixer architectur base exclus multi layer perceptron mlp mlp mixer contain two type layer one mlp appli independ imag patch e mix per locat featur one mlp appli across patch e mix spatial inform when train larg dataset modern regular scheme mlp mixer attain competit score imag classif benchmark pre train infer cost compar state art model we hope result spark research beyond realm well establish cnn transform
niujin,MachineLearning,1620380538.0,[D] Predictive model for the shape of an entire histogram,i work project market research survey respond repli survey nmbr point scale nmbr dislik nmbr indiffer nmbr like the respons shown histogram i would like develop ml model predict shape histogram survey survey run wild i databas past survey countri industri etc it straightforward predict singl valu mean histogram train machin learn model predict entir histogram so far approach i consid train nmbr separ independ model train model mean one stdev assum normal bad assumpt i know histogram mani differ shape design custom machin learn architectur nmbr output when i train model predict mean histogram best perform come ensembl model random forest use auto ml azur ml ha anybodi tri someth similar i new market research data scienc sever year
michaelaalcorn,MachineLearning,1619522727.0,[R] baller2vec++: A Look-Ahead Multi-Entity Transformer For Modeling Coordinated Agents,
hardmaru,MachineLearning,1619579460.0,[R] Why AI is Harder Than We Think,
donkey_strom16001,MachineLearning,1619388491.0,[D] The Rants of an experienced engineer who glimpsed into AI Academia (Briefly),background i recent graduat master degre fortun unfortun glimps whole academ side ml i took thesi track degre immigr harder get good research lab without authorship coupl good paper or i delud i work full stack swe startup nmbr year come us master degre focus ml ai i everyth year from project manag build fulli polish s w product devop even dabbl ml i batchelor degre univers whose name even worth mention the univers master degre top nmbr ai space i know much ml curios drove univers come uni i focus learn ml ai one nmbr nmbr year i found advisor thesi topic thi fun start i amaz advisor entir peer review system way assess ml scienc tick thi rant begin rant nmbr acadmia follow gate institut narr let say ph d world top ai institut work best prof you way higher likelihood get good postdoc huge research lab vs someon poor countri ph d well known advisor publish well known paper i come develop nation i see mani time in countri academ get fund colleg us one reason colleg huge endow mani academ wealthi research sponsor brand name prestig carri massiv weight help get fund us academ circl thi prestig money percol student research work student top colleg get huge advantag circl top research keep set institut i noth top research top institut due natur citat way money flow base viciou cycl creat best institut keep get better rest get much notic rant nmbr peer review without code review ml ai shadi i comput scientist i appal i heard need code review research paper as comput scientist someon actual shit ton actual ml past year i find absolut garbag code review part system i say everi scientist read paper review code least one person paper code submiss at least ml ai space thi basic i get peopl call comput scientist want read fuck code if make grad student but collect scienc need the core problem lie fact peer review free there better solut we end creat git chang mani live academ research need someth similar rant nmbr my idea novel until i see someon els paper the volum scientif research grow exponenti inform creat faster digest we expect peopl know everyth amount overlap ai ml field requir way better search engin googl scholar the side effect larg volum research everi paper someth novel make harder filter fuck novel i mani experi i code someth came realiz someon els done someth symbol similar work seem like small variant that fuck head is i novel what fuck novel is stitch transform problem fanci embed tidi research paper novel is make transform bigger novel is new rl algorithm test nmbr seed fanci fuck prior esoter reason success novel is use parameter model get nmbr accuraci nmbr sampl test set novel is appli self supervis learn new dataset novel if i keep list question novelti i probabl write novel ask fuck novel rant nmbr citat base optim promot self growth over collect growth whatev peopl may say collabor academia intrins promot right incent structur harbor collabor let explain when write paper posit name matter if ph d student first author paper great if nth author not great appar touchi thing academ and lot ego clash around number order name i distinctli rememb attend seminar lab approach student research project idea the first thing came phd student mouth posit authorship as engin work team past never someth i thought especi i work industri alway group person academia revers academia applaud celebr individu achiev all understand someth i like thi make phd stick lane the way citat research focu calibr hire abil complet ph d thesi metric peopl incentiv think instead think collabor make someth better conclus a ph d idealist sens pursuit hard idea i poetic way in situat like publish perish word paper get pass scienc without even see code run i extrem discourag go rout all rant diss scientist i commun need better way address problem p s never expect mani peopl express opinion rant u take serious as mani peopl state i outsid tini experi give full pictur i realiz post come someth tri dichotom academia industri i tri i want highlight problem i saw one person blame these issu opinion byproduct econom creat system thank gold stranger
RSchaeffer,MachineLearning,1619728964.0,[R] Help understanding NeurIPS 2013 Dirichlet Process Mixture Model paper,hi i struggl understand certain part nmbr neurip paper onlin learn nonparametr mixtur model via sequenti variat approxim http proceed neurip cc paper nmbr hash nmbrcnmbrfnmbrenmbrenmbrcbnmbrddnmbrfnmbrdnmbrecf abstract html http proceed neurip cc paper nmbr hash nmbrcnmbrfnmbrenmbrenmbrcbnmbrddnmbrfnmbrdnmbrecf abstract html if anyon subreddit familiar bayesian nonparametr five minut i would realli appreci answer question i post math stackexchang http math stackexchang com question nmbr onlin stochast variat infer dirichlet process mixtur model http math stackexchang com question nmbr onlin stochast variat infer dirichlet process mixtur model base paper review review nmbr question i think author intend add answer supplement supplement start thi document provid proof theorem present paper never actual got around ad proof answer i email sole author i yet hear back
answersareallyouneed,MachineLearning,1617655429.0,[D] Questions on mathematical maturity for PhD/R&D ML,my current job mostli involv implement paper adapt model fit need compani math realli issu understand implement paper so far i believ i lack mathemat matur competit posit go back phd i work research past i specif interest domain adapt synthet data gener a question nmbr is common peopl come work gener understand concept slowli build matur a lot mentor math physic major later came machin learn perhap idea take bit skew nmbr i nmbr year i want appli start phd i plan work full time year what effect way use time what i studi first a colleagu recommend i go real analysi it also seem like good portion subreddit gone bishop the element statist learn least tldr i interest field would like mediocr mid level profession ani advic
ML_WAYR_bot,MachineLearning,1618171211.0,[D] Machine Learning - WAYR (What Are You Reading) - Week 110,thi place share machin learn research paper journal articl read week if relat research mean elabor give us insight otherwis could interest paper read pleas tri provid insight understand pleas post thing present wiki prefer link arxiv page pdf easili access pdf summari page way around pertin link previou week nmbr nmbr nmbr nmbr nmbr nmbr nmbr nmbr nmbr nmbr nmbr nmbr nmbr nmbr nmbr nmbr nmbr nmbr nmbr nmbr nmbr nmbr week nmbr http www reddit com nmbrqyjiq week nmbr http www reddit com nmbrxwnmbr week nmbr http www reddit com nmbrildf week nmbr http www reddit com nmbrsnmbrknmbru week nmbr http www reddit com nmbrtnnmbrax week nmbr http reddit com nmbrsnmbrelnmbr week nmbr http reddit com bfsxnmbrz week nmbr http reddit com dnmbrvnonmbr week nmbr http reddit com fnmbrfnmbriq week nmbr http reddit com hltnmbro week nmbr http reddit com knmbrywb week nmbr http www reddit com nmbrsnmbrxqm week nmbr http www reddit com nmbracbnmbrt week nmbr http www reddit com nmbrjwde week nmbr http www reddit com nmbrabnmbri week nmbr http www reddit com nmbrwvjfk week nmbr http reddit com anmbropot week nmbr http reddit com blnmbrov week nmbr http reddit com denmbrhnmbr week nmbr http reddit com fnmbrfsnmbrz week nmbr http reddit com hunmbrzqnmbr week nmbr http reddit com khnmbrnx week nmbr http www reddit com nmbrtnmbrmqm week nmbr http www reddit com nmbrcwfbnmbr week nmbr http www reddit com nmbr week nmbr http www reddit com nmbrd week nmbr http www reddit com nmbrexnmbr week nmbr http reddit com anmbryaro week nmbr http reddit com bqlbnmbrv week nmbr http reddit com dkoxnmbr week nmbr http reddit com ffinmbrb week nmbr http reddit com iaznmbr week nmbr http reddit com kpsxtc week nmbr http www reddit com nmbrubnmbrkw week nmbr http www reddit com nmbrfcnmbrmh week nmbr http www reddit com nmbrhhhb week nmbr http www reddit com nmbrjsnmbr week nmbr http reddit com nmbraluh week nmbr http reddit com adnmbrssz week nmbr http reddit com bwnmbrjmnmbr week nmbr http reddit com drnmbrnca week nmbr http reddit com fnnmbrrnmbr week nmbr http reddit com ijjcep week nmbr http reddit com kzevku week nmbr http www reddit com nmbrxomfnmbr week nmbr http www reddit com nmbrhynmbrur week nmbr http www reddit com nmbrteiz week nmbr http www reddit com nmbrbnmbravnmbr week nmbr http reddit com nmbrtnnez week nmbr http reddit com ainmbrgi week nmbr http reddit com cnmbritkk week nmbr http reddit com dxshkg week nmbr http reddit com fvknmbrjnmbr week nmbr http reddit com isnmbrhjnmbr week nmbr http reddit com lnmbrlvg week nmbr http www reddit com nmbrzcyvk week nmbr http www reddit com nmbrkdnmbrvd week nmbr http www reddit com nmbrdnmbrnbnmbr week nmbr http www reddit com nmbrenmbrfxnmbr week nmbr http reddit com nmbrxnmbroj week nmbr http reddit com apnmbrctk week nmbr http reddit com cdnmbrgko week nmbr http reddit com enmbrnmyk week nmbr http reddit com gnmbreavg week nmbr http reddit com jnmbrxrnmbr week nmbr http reddit com ljxnmbrn week nmbr http www reddit com nmbrtnmbrmo week nmbr http www reddit com nmbrobnmbrdx week nmbr http www reddit com nmbrgngwc week nmbr http www reddit com nmbrhccnmbrc week nmbr http reddit com nmbrjmh week nmbr http reddit com aucinmbrc week nmbr http reddit com cjnmbrkyc week nmbr http reddit com ebnmbrlxk week nmbr http reddit com gcxnmbruf week nmbr http reddit com jnmbrcbf week nmbr http reddit com luqbxl week nmbr http www reddit com nmbrheol week nmbr http www reddit com nmbrrnmbryd week nmbr http www reddit com nmbrjgdva week nmbr http www reddit com nmbrkgcqr week nmbr http reddit com nmbrupnmbrg week nmbr http reddit com azjoht week nmbr http reddit com cpnmbrjex week nmbr http reddit com ehbfst week nmbr http reddit com glmnmbrsv week nmbr http reddit com jhzznmbrv week nmbr http reddit com mnmbrunmbrz week nmbr http www reddit com nmbrkvsu week nmbr http www reddit com nmbrttnmbrcz week nmbr http www reddit com nmbrmnmbrlnmbrv week nmbr http www reddit com nmbrnayri week nmbr http reddit com nmbrnnmbrrt week nmbr http reddit com bnmbrrnmbri week nmbr http reddit com cvdenmbra week nmbr http reddit com entcxi week nmbr http reddit com gunmbrtnmbrd week nmbr http reddit com jqjgonmbr week nmbr http reddit com mfnmbrmnmbru week nmbr http www reddit com nmbrsnmbroa week nmbr http www reddit com nmbrwhnmbrwb week nmbr http www reddit com nmbrpnmbrhanmbr week nmbr http www reddit com nmbrqelnmbrp week nmbr http reddit com nmbrcfnmbr week nmbr http reddit com bakewnmbr week nmbr http reddit com dnmbrgnmbrknmbr week nmbr http reddit com euctyw week nmbr http reddit com hddfnmbrj week nmbr http reddit com jznmbrevt most upvot paper two week ago u rtrxnmbr how machin learn team share reus featur http www tecton ai blog machin learn team share reus featur u justdi effici explor chemic space dock deep learn http chemrxiv org articl preprint efficient_exploration_of_chemical_space_with_docking_and_deep learn nmbr u kirillthemunchk styleclip text driven manipul stylegan imageri sota stylegan imag edit http casual_gan nmbr besid rule fun
Farconion,MachineLearning,1620063831.0,[D] Effectively summarizing projects & research on a resume?,anyon tip effect summar ml project research resum i find sinc project research usual pretti nich tri convey uphil battl peopl read resum go idea talk enough space cover appropri background knowledg i get part job appli sinc i bank get ml posit colleg good chunk work ml relat i like make background approach unfamiliar field subfield relat work
mistermysterioyster,MachineLearning,1619897023.0,"[D] Paper Reading Group #018 - MP3: A Unified Model to Map, Perceive, Predict and Plan. (Link to full slides in comments!)",
