Author,Subreddit,Date,Title,Post
mrathi12,MachineLearning,1618417597.0,[D] Addressing Gender Bias in Neural Machine Translation,hey everyon i made video discuss fix bia neural machin translat http youtu pnmbrfjlmfnmbrfw http youtu pnmbrfjlmfnmbrfw everi often get viral tweet come assign gender gender neutral languag like hungarian googl translat default stereotyp translat thi video look evalu gender bia use dataset winomt http www aclweb org antholog pnmbr nmbr pdf http www aclweb org antholog pnmbr nmbr pdf discuss current solut googl translat add intellectu debt final i believ practic approach debias larg languag model domain adapt http arxiv org ab nmbr http arxiv org ab nmbr person i think curat larg dataset scale need impract much practic fine tune small curat dataset http link springer com articl nmbr snmbr nmbr nmbr nmbr http link springer com articl nmbr snmbr nmbr nmbr nmbr would interest hear thought think practic approach debias twitter thread discuss http twitter com mukulrathi _ statu nmbr nmbr http twitter com mukulrathi_ statu nmbr nmbr transcript http mukulrathi co uk googl translat bias http mukulrathi co uk googl translat bias
CrypticParagon,MachineLearning,1617351673.0,[D] When does stratified k-fold cross-validation provide worse performance than standard k-fold?,i use sklearn train random forest model default paramet the dataset nmbrk data point nmbr featur binari classif nmbr nmbr all nmbr featur simpl likelihood label nmbr given specif valu categor featur i use built cross valid nmbr fold the thing i chang standard vs stratifi stratifi perform slightli wors whi would
jj4646,MachineLearning,1619239890.0,"[D] Relationship Between Kernels, Neural Networks and Gaussian Process",at initi artifici neural network ann equival gaussian process infinit width limit thu connect kernel method can someon pleas provid intuit exampl sort connect neural network gaussian process kernel thank sourc http arxiv org pdf nmbr pdf http arxiv org pdf nmbr pdf
Seankala,MachineLearning,1620131965.0,[D] Do you guys take out time to study math?,for month i take time everyday studi math i nmbrth semest msc degre undergrad background stem i alway feel like i lack strong mathemat foundat also i read paper lot mathemat formul sometim i get intuit understand equat mean often take hour even day googl i curiou whether anyon els goe way brush studi math stuff sometim feel futil i tri tell otherwis
jj4646,MachineLearning,1619239577.0,[D] Automatic Feature Engineering during Deep Learning,i often heard one reason deep learn method prefer machin learn method algorithm like deep neural network requir analyst spend much time select variabl model e featur engin featur select featur extract appar deep neural network abl intellig background consid creat mani differ combin featur conduc model problem natur i curiou claim intuit i understand hidden layer weight activ function neural network make new combin featur pass forward ultim use make predict new data beyond i sure think refer paper document either theoret empir deep neural network abl larg take care task featur engin compar tradit algorithm like regress model decis tree random forest have experi done mani irrelev featur ad dataset deep neural network abl ignor
NotThatGuy97,MachineLearning,1617633514.0,[D][P] Feedforward Noise Cancelling Project. Looking for some advice before i dive into details.,hi i beginn ml finish one minor project yet use simpl neural network now i head toward new project complex search good approach sinc i much experi i want introduc project hope idea which approach make sens nn rnn rl altern approach the main goal project find paramet amplitud a _i phase p _i fix frequenc nmbrhz nmbrhz sinusoid signal gener the gener signal ad main signal order cancel nois consist n x nmbrhz frequenc basic nois channel problem solv feedforward algorithm the input measur durat nmbr nmbr second main signal if fourier transform fft perform amplitud nmbrhz harmon nmbrhz nmbrhz nmbrhz clearli observ fft with correct a _i p _i amplitud frequenc suppress frequenc compens addit introduc signal creat signal gener the goal find perfect a _i p _i frequenc the first measur shown fft _amplitud frequenc uniqu minimum found gradient toward minimum observ simplifi fft _amplitud a _i nmbr p _i nmbr the loop optim would look like nmbr measur main signal fft nmbr input n x nmbr array fftamptitud _nmbr fftamptitud _n nmbr optim algorithm nn rnn rl nmbr output n x nmbr array a _nmbr p _nmbr a _nmbr p _nmbr a _n p _n nmbr signal process nmbr measur main signal ad signal the loss function could look like loss sum fftamptitud _i tri minim loss function sinc fft _amplitud a _i nmbr p _i nmbr train simul creat order pre train algorithm i hope i made situat clear one problem the output array paramet loss function calcul measur point nmbr see i would treat output layer order get backpropag work right pleas add advic furthermor algorithm alway wait measur is issu i want use kera what think are nn rnn rl capabl solv task which would best approach what problem see do know compar project paper pleas share
timscarfe,MachineLearning,1618582221.0,[D] Francois Chollet interview on ML Street Talk,in today show join francoi chollet he extrem interest view intellig generalis abstract inform convers ratio he wrote measur intellig end nmbr huge impact think he think nn model continu problem well smooth learnabl manifold mani type nmbr problem involv reason plan suitabl nn he think mani problem type nmbr type nmbr enmesh togeth he think futur ai must includ program synthesi allow us generalis broadli exampl search could guid neural network search space interpol extent video http youtu jnmbrp _thjjnoo http youtu jnmbrp_thjjnoo pod http anchor fm machinelearningstreettalk episod nmbr francoi chollet intellig generalis evnmbrinmbr http anchor fm machinelearningstreettalk episod nmbr francoi chollet intellig generalis evnmbrinmbr
anon-burner-5981,MachineLearning,1620412872.0,[D] Parting Gifts for Lab Director and Ph.D. Student,i spent last two year work amaz lab next year i leav they tremend impact i like abl give someth show appreci what would good gift mentor ph d student
Square365,MachineLearning,1617649803.0,[D] Good video dataset labeling services? (Frame By Frame),hello sort new ml i tri make dataset train imag recognit yolovnmbr week im use darklabel aproxim nmbrk frame nmbr video label im plan label anoth nmbr i would like know good servic label rate i seen amazon mturk box imag video topic i got estim someon will nmbrvideo nmbr i would like get opinion
AristocraticOctopus,MachineLearning,1619491330.0,[N] Toyota subsidiary to acquire Lyft's self-driving division,after zoox sale amazon uber layoff ai research look grim self drive commerci i doubt mani sub terribl surpris given difficulti problem still sad see anoth one bite dust person i fan comma ai technic approach human polici clone i still think dozen high qualiti research paper away superhuman drive agent interest see peopl valu divis lyft receiv total approxim nmbr million cash transact nmbr million paid upfront subject certain close adjust nmbr million payment five year period the transact also expect remov nmbr million annual non gaap oper expens net basi primarili reduc r d spend acceler lyft path adjust ebitda profit
Symbiot10000,MachineLearning,1618176734.0,[D] Practical benefits of unlocking vGPU functionality in NVIDIA cards for ML?,over weekend lot attent http news ycombin com item id nmbr given http old reddit com r hardwar comment mnordnmbr unlock_vgpu_functionality_for_consumer_grade_gpu new softwar method http github com dualcod vgpu_unlock unlock vgpu function consum nvidia card what mean anyth smaller ml outfit could divid gpu resourc across vm subdivid gpu across differ ml task
Competitive-Rub-1958,MachineLearning,1618587934.0,[D] Can some other organization/company replicate GPT-3 for their own use?,gpt nmbr creat much new innov per se overfit model huge amount data larg number paramet probabl base predecessor architectur less so easi compani like googl faang compani replic gpt nmbr size nlp model use but million dollar question inde easi much advantag openai prevent googl launch new model bigger better offer consum cheaper openai ms
lukeiy,MachineLearning,1617422679.0,[P] A TF implementation of AdamW with a One-Cycle policy,http preview redd nmbrwucnmbrrluvqnmbr png width nmbr format png auto webp nmbrbnmbrcnmbrbcnmbrfbnmbrenmbrfdnmbreacnmbrcnmbrenmbrccnmbr http github com lukebolli onecycleadamw http github com lukebolli onecycleadamw when articl fast ai http fast ai origin post recept mix i recent implement though model sped train remain stabl higher learn rate i ad small exampl compar regular adam adamw let know issu cheer
proximauri,MachineLearning,1616976163.0,[D] Face recognition: classification vs distances between embeddings,hi i new face recognit method i notic one popular approach use pre train model new dataset measur distanc two embed i understand howev prefer use pre train network without top layer fine tune new fulli connect layer top model honestli i even understand train model first approach could someon clarifi pleas
alexandrea_pierrick,MachineLearning,1617958906.0,[D] Unsupervised document similarity state of the art,i set n document length rang nmbr nmbr charact i want calcul similar score nmbr nmbr pair document higher number indic higher similar assum deploy supervis model infeas due resourc constraint necessarili data scienc relat gather label expens infrastructur approv supervis model whatev reason etc approach i consid nmbr tf idf nmbr smooth invers frequenc sif embed develop usif p sif http openreview net pdf id syknmbrvnmbrxx http openreview net pdf id syknmbrvnmbrxx http www aclweb org antholog wnmbr nmbr http www aclweb org antholog wnmbr nmbr http arxiv org ab nmbr http arxiv org ab nmbr nmbr bert bert like embed e g http arxiv org ab nmbr http arxiv org ab nmbr nmbr hierarch optim transport document represent hott http paper nip cc paper nmbr hash nmbrbnmbranmbranmbrbafnmbrenmbrenmbrcnmbrenmbranmbrbnmbr abstract html http paper nip cc paper nmbr hash nmbrbnmbranmbranmbrbafnmbrenmbrenmbrcnmbrenmbranmbrbnmbr abstract html question is unsupervis techniqu shown peer review set achiev higher accuraci fnmbr similar long text say nmbr charact hott background the hott paper benchmark variou approach k nn classifi show hott perform best dramat better tf idf hott nmbr vs tf idf nmbr normal error note hott algorithm unsupervis dataset paper label otherwis benchmark would possibl the sif paper mostli deal st dataset long text p sif benchmark reuter dataset use svm supervis approach interestingli hott paper find sif perform well k nn approach nmbr normal error in mani case bert requir pre train max averag pool perform pool bert layer appear wors glove embed http arxiv org ab nmbr http arxiv org ab nmbr page nmbr i also abl find unsupervis benchmark docnmbrvec univers sentenc encod use there addit question calcul similar embed obtain e g http www aclweb org antholog nnmbr nmbr pdf http www aclweb org antholog nnmbr nmbr pdf scope question unless affect comparison unsupervis benchmark e g k nn approach use variou distanc metric may affect accuraci if benchmark hott repres method exist perform substanti better tempt make conclus tf idf still strong approach sinc simpl implement understand certainli simpler hott if case i think remark conclus given deep learn develop last nmbr nmbr year edit ad pool bert layer
noodlepotato,MachineLearning,1619701885.0,[D]Anyone reading Probabilistic Machine Learning: An Introduction? (Murphy's new textbook),alreadi post r learnmachinelearn answer how far is addit differ edit like notat wise i heard first edit pretti inconsist notat i ask i plan buy nmbr machin learn probabilist perspect physic book check tabl content new one i might consid buy physic book edit instead just want know other think read
Guest_Basic,MachineLearning,1617344944.0,[D] AUC vs F-measure for binary classification for unbalanced target variable,i work build binari classif predict model my target variabl extrem unbalanc nmbrk nmbr nmbrmillion nmbr as i understand auc good metric evalu model f measur might better altern question nmbr assumpt correct the model i built decent auc nmbr realli low f measur nmbr thi make think i actual built realli bad model howev exist publish literatur claim auc nmbr none report f measur question nmbr if goal build better model current exist i take victori lap right
amourav,MachineLearning,1619529111.0,[D] Distributed data platform / framework,what thought aw sagemak horovod distribut data train what method choic
moajjem04,MachineLearning,1618508700.0,[D] Best Literature Review Practices,my supervisor assign new topic research typic project i mostli handl experi part thi time i thought i literatur review well i know huge defici part i want know best practic do ts beyond search googl scholar keyword tl dr help senpai provid knowledg
SlickBlueML,MachineLearning,1619025945.0,[P] Multilingual translation like Google Translate with PyTorch (+explanation),i recent put togeth tutori multilingu translat i think code alon might use peopl it includ demo play around get run support chines japanes english right bat with small amount train work surprisingli well i colab need worri setup use if use non pro version colab though make sure chang model repo googl mtnmbr base googl mtnmbr small els get memori error cuda github code http github com ejmejm multilingu nmt mtnmbr blob main nmt _full _version ipynb http github com ejmejm multilingu nmt mtnmbr blob main nmt_full_vers ipynb colab code http colab research googl com drive nmbregscodnmbrsjwd _yofwbnmbrkmjoedzgunmbrlp usp share http colab research googl com drive nmbregscodnmbrsjwd_yofwbnmbrkmjoedzgunmbrlp usp share there also video seri goe anyon interest http www youtub com watch v huzqnmbrkklxnmbrq list pl _nmbrvdnmbrkwq _obgmwnmbrgnmbrhmolndynmbrnhvnmbr index nmbr nmbr http www youtub com watch v huzqnmbrkklxnmbrq list pl_nmbrvdnmbrkwq_obgmwnmbrgnmbrhmolndynmbrnhvnmbr index nmbr nmbr
wecmiw,MachineLearning,1618074938.0,[D] How do you share your models/ demos with others?,hi i phd student work deep learn i often show demo model i current simpli share result present use notebook i want show explicit experi spot is anoth way i could see done lot especi industri talk mani stakehold i awar gradio i wonder way ani insight appreci
hubert0527,MachineLearning,1617996004.0,[R] InfinityGAN: Towards Infinite-Resolution Image Synthesis,synthes infinit resolut imag finit resolut input a nmbr nmbr imag compos nmbr patch independ synthes infinitygan spatial fusion two style the gener train nmbr nmbr patch e g mark top left sampl nmbr nmbr real imag note train infer resolut perform singl gtx titan x gpu http preview redd nmbrdrmgnmbreznmbrsnmbr png width nmbr format png auto webp nmbrdnmbranmbraanmbrcnmbrenmbrenmbranmbrenmbrcnmbrbnmbrenmbrb tl dr we propos infinitygan toward new problem synthes infinit resolut imag the model train imag limit resolut gener arbitrari resolut test we demonstr sever applic train gener spatial style fusion imag outpaint imag inbetween project page http hubertnmbr github io infinitygan http hubertnmbr github io infinitygan paper http arxiv org ab nmbr http arxiv org ab nmbr we releas code soon http github com hubertnmbr infinitygan http github com hubertnmbr infinitygan
SensitiveAnteater420,MachineLearning,1616960506.0,[D] Would it be possible to make a model that predicts where a picture is taken?,i love osint geoloc i python dev wonder i extend boundari the titl self explain is possibl make model predict pictur taken exist dataset
InsightFinder,MachineLearning,1617028825.0,[News] Women in computer science leadership talk on 4/9,event alert women tech leadership discuss exec bank america dell insightfind on april nmbr nmbr nmbr am est insightfind cto founder helen gu particip women tech leadership panel host nc state women comput scienc wic organ professor gu teach nc state also faculti leader wic she join industri leader liz holland vice presid dell technolog betsi bradi manag director bank america moder nc state professor wic faculti leader dr lina battestilli these leader agre share stori includ limit earli career decis watersh career moment would advis young student profession today all welcom attend to join regist websit form http insightfind com event googl form http doc googl com form e nmbrfaipqlsenmbrhyyvpgljvqiwoblsnmbrifmcztdgrynrznmbryotnmbrmnnmbrcnnmbrwrnmbrg viewform
asivokon,MachineLearning,1617719141.0,[N] Grammarly releases a grammatical error correction (GEC) dataset for the Ukrainian language,thi dataset contain nmbr nmbr sentenc annot grammat error fluenci correct the licens cc by nmbr thi blog post provid context http www grammarli com blog engin announc ua gec http www grammarli com blog engin announc ua gec the data code github http github com grammarli ua gec http github com grammarli ua gec paper draft http arxiv org ab nmbr http arxiv org ab nmbr i one author happi answer question
shreyansh26,MachineLearning,1620580380.0,[P] BERT - Annotated Paper + Paper Summary,everyon interest nlp even dl ml matter definit heard bert famili model bert roberta distilbert mani mani thi paper bert pre train deep bidirect transform languag understand first introduc complet chang way ai practition solv look nlp problem day as part paper note seri i gone paper creat inform summari paper thi time goe bit longer previou paper summari done the paper contain mani tini interest nugget i includ check link happi read paper summari bert pre train deep bidirect transform languag understand http shreyanshnmbr github io post nmbr nmbr nmbr_pretraining_deep_bidirectional_transformers_bert annot paper http github com shreyanshnmbr annot ml paper blob main bert pdf http github com shreyanshnmbr annot ml paper blob main bert pdf
techsucker,MachineLearning,1618972153.0,[R] Researchers Introduce a Convolutional Neural Network (CNN)-Based Model that Automates the Distinction Between Natural Images and Computer-Generated Images (CGI),with increas perform accuraci comput softwar system realist appear comput gener imag cgi deepfak often lead assum authent imag research changsha univers scienc technolog hunan univers hunan china recent develop imag sourc pipelin forens method base convolut neural network cnn autom distinct natur imag cgi the work announc intern journal autonom adapt commun system describ cnn base model fine tune use databas nmbr imag summari http www marktechpost com nmbr nmbr nmbr research introduc convolut neural network cnn base model autom distinct natur imag comput gener imag cgi http www marktechpost com nmbr nmbr nmbr research introduc convolut neural network cnn base model autom distinct natur imag comput gener imag cgi paper http www indersci com offer php id nmbr
Yuqing7,MachineLearning,1617064776.0,[N] DeepMind & Alberta U Introduce Novel Search Algorithm: Policy-Guided Heuristic Search with Guarantees,a research team deepmind alberta univers propos polici guid heurist search ph novel search algorithm use heurist function polici offer guarante search loss relat qualiti heurist polici here quick read deepmind alberta u introduc novel search algorithm polici guid heurist search guarante http syncedreview com nmbr nmbr nmbr deepmind alberta u introduc novel search algorithm polici guid heurist search guarante the paper polici guid heurist search guarante arxiv http arxiv org pdf nmbr pdf
vwxyzjn,MachineLearning,1619399521.0,[P] Open Reinforcement Learning Benchmark 0.5.0,
ilikepancakez,MachineLearning,1619018686.0,On the Relationships Between the Grammatical Genders of Inanimate Nouns and Their Co-Occurring Adjectives and Verbs [R],
Xxyjoel,MachineLearning,1617007872.0,ML + Infrastructure [P],hey all i data scienc machin learn space major career recent spent time meddl around infrastructur could naiveti though complex ineffici bundl cloud tool bother i built tool help manag cost it still requir polici finagl self servic yet howev i love all candid feedback tool bluearch io http bluearch io apolog sub rule share work scari i pretti excit project
thermokopf,MachineLearning,1617657632.0,[D] Can the same convolutional network be used on different image sizes?,convolut network perform convolut imag array pixel basic decreas size imag input typic feedforward network how gener handl differ imag size for exampl i train network bunch nmbrxnmbr imag will i abl use network make predict nmbrxnmbr imag size
flaviojuvenal,MachineLearning,1619445763.0,[P] Entity Embed: fuzzy and scalable Entity Resolution using Approximate Nearest Neighbors,http github com vintasoftwar entiti emb http github com vintasoftwar entiti emb entiti emb base special case autoblock model describ amazon http www amazon scienc public autoblock hand block framework entiti match it allow transform entiti like compani product etc vector support scalabl record linkag entiti resolut use approxim nearest neighbor use entiti emb train deep learn model transform record vector n dimension embed space thank contrast loss vector organ keep similar record close dissimilar record far apart embed space embed record enabl scalabl ann search http ann benchmark com index html mean find thousand candid duplic pair record per second per cpu thi first deep learn project launch hope use pleas feel free reach feedback
hardmaru,MachineLearning,1617347384.0,[R] On the role of planning in model-based deep reinforcement learning,
,MachineLearning,1619991678.0,"[D] What is the reason behind the recent explosion in NLP-based research, jobs, and tools?",i notic nlp quit renaiss moment past nmbr year to kinda came nowher i sure expert saw come anyway i see much nlp research publish well everi compani seek peopl nlp knowledg whi what caus led explos nlp past nmbr nmbr year
mhj,MachineLearning,1619270649.0,"[P] Implementations of Apriori, Eclat and FP-Growth in Go",
ObjectiveDue9905,MachineLearning,1617205094.0,[D] How important is controls theory in machine learning?,hi i wonder import control theori machin learn seem go hand hand applic i current comput engin major student taken mostli cs cours come machin learn control theori cours ece electr comput engin depart i interest take seem applic i could see use hardwar softwar futur
samk2104,MachineLearning,1617093257.0,[D] Not all independent variables available for same time period..how to handle such situations for ML models?,i nmbr nmbr independ variabl inform avail last nmbr year includ depend variabl for nmbr nmbr variabl inform avail last nmbr month featur recent launch the simplest way would build model nmbr month variabl avail number data point enough is way i incorpor new featur model e use nmbr month data nmbr nmbr featur i still build model use nmbr year data
NotAHomeworkQuestion,MachineLearning,1616962377.0,"[D] Instead of taking an approach like Invariant Risk Minimization, why is it not enough to control for environmental factors (confounders) by including them as regressors?",i start dive fascin topic pleas excus ignor i realli enjoy read irm paper left wonder accomplish someth similar includ environment variabl regressor peopl causal infer for exampl mnist color applic could final layer model take top layer usual plain vanilla cnn well indic color imag we thu control color confound imag cnn part model architectur account everyth as worri shenanigan futur data point effect color revers thu creat predict futur data point ignor color effect predict thi i think would give similar result gray imag shown give excel perform what i miss
rom1504,MachineLearning,1616491364.0,[P] fromconfig: A library to instantiate any Python object from configuration files.,fromconfig http github com criteo fromconfig act gener command line interfac configur file absolut chang code fromconfig http preview redd xnmbrlnmbrlzwqonmbr png width nmbr format png auto webp cnmbrdnmbrfenmbrdnmbrfnmbrbanmbrcnmbrdnmbr it particularli well suit machin learn see exampl http github com criteo fromconfig machin learn launch train job remot cluster requir custom command line argument need propag call stack e g set paramet particular layer the usual way write custom command reduc set argument combin assembl creat differ object with fromconfig command line becom gener specif kept config file as result preserv code backward depend issu allow full reproduc save config file job artifact it also make easier merg differ set argument dynam way refer interpol
TheOverGrad,MachineLearning,1619902564.0,Memory-Efficient Semi-Supervised Continual Learning (IJCNN2021 oral),
cowgod2007,MachineLearning,1617853595.0,[D] Sourcing medical data?,hey for ml project one sourc buy obtain medic label data train data e g label radiolog imag data thank
JST99,MachineLearning,1619188054.0,[D] How to properly version control ML models amid rapid experimentation?,come softwar engin background i use git version control file along config json includ model train hyperparamet a trainer class would read specifi configur file train model save best one highest valid score thi pipelin work begin i iter slow pace recent howev i increasingli realiz save checkpoint file obsolet non trivial chang made model architectur sinc last experi by checkpoint i realli refer torch load some_state_dict question framework agnost i could cours check experi conduct git checkout repositori specif point time howev part believ incred common thing ml engin must eleg solut so far research brought sacr http sacr readthedoc io en latest index html i got post http www reddit com r machinelearn comment nmbrnpgnmbrd how_to_keep_track_of_experi keepsak http keepsak ai dvc http dvc org appear tangenti sinc question pertain model data thank advanc share insight
