Author,Subreddit,Date,Title,Post
hardmaru,MachineLearning,1617802883.0,[R] Biological structure and function emerge from scaling unsupervised learning to 250 million protein sequences,recent paper fair publish pna http www pna org content nmbr nmbr enmbr they find biolog structur function emerg represent languag model train massiv databas protein sequenc summari learn biolog properti sequenc data logic step toward gener predict artifici intellig biolog here propos scale deep contextu languag model unsupervis learn sequenc span evolutionari divers we find without prior knowledg inform emerg learn represent fundament properti protein secondari structur contact biolog activ we show learn represent use across benchmark remot homolog detect predict secondari structur long rang residu residu contact mutat effect unsupervis represent learn enabl state art supervis predict mutat effect secondari structur improv state art featur long rang contact predict abstract in field artifici intellig combin scale data model capac enabl unsupervis learn led major advanc represent learn statist gener in life scienc anticip growth sequenc promis unpreced data natur sequenc divers protein languag model scale evolut logic step toward predict gener artifici intellig biolog to end use unsupervis learn train deep contextu languag model nmbr billion amino acid across nmbr million protein sequenc span evolutionari divers the result model contain inform biolog properti represent the represent learn sequenc data alon the learn represent space multiscal organ reflect structur level biochem properti amino acid remot homolog protein inform secondari tertiari structur encod represent identifi linear project represent learn produc featur gener across rang applic enabl state art supervis predict mutat effect secondari structur improv state art featur long rang contact predict paper http www pna org content nmbr nmbr enmbr
Artistic-Mushroom974,MachineLearning,1617240597.0,[d] Robotics/ AI PhD Salary Expectations for T1.5 School,i junior first year phd student robot ai gtech cs rank ai robot put gtech nmbr us http csrank org index ai vision mlmine nlp ir robot us http csrank org index ai vision mlmine nlp ir robot us i seen post nmbr nmbrk total comp post ml ai phd big tech fintech i also seen caveat like top nmbr mit stanford cmu berkeley school phd http www reddit com r machinelearn comment bwwmhnmbr _do _a _phd _i _not _worth _it _unless _except http www reddit com r machinelearn comment bwwmhnmbr d_doing_a_phd_is_not_worth_it_unless_except so question realist salari expect next coupl school top nmbr are much wors top nmbr do i still good prospect nmbr nmbrk offer would low mid high rang also prospect i take master rather finish full degre for context mani lab school fair outstand amount top confer public iclr neurip icml corl icra and money reason i chose rout i lot curios possibl ai demand difficult work
_Arsenie_Boca_,MachineLearning,1620455301.0,[D] Worth learning JAX?,recent popular paper vit start use jax implement model i mainli use pytorch past i play thought learn tensorflow i alway felt like tensorflow lot legaci code convent make kinda unneccessarili complic compar pytorch nmbr now googl seem shift jax intern think jax replac tensorflow nmbr and regardless worth learn jax nmbr if would learn jax higher level api compar torch nn would use like stax flax haiku
memgamemotron,MachineLearning,1617048073.0,[P] Need help figuring out how to print out the sentence and sentence predictions from my google trax neural network model.,begin project i help school gain experi i taken plenti deeplearn ai http deeplearn ai cours help build code foundat the data chat bot provid chat text angri label happi label go feed model http preview redd iyonmbrsgfgonmbrqnmbr png width nmbr format png auto webp nmbrdnmbrafnmbrbnmbrbeenmbrefnmbrfnmbr next data preprocess includ split data nmbr nmbr train evalu http preview redd qknmbrdnmbrinmbrwonmbrqnmbr png width nmbr format png auto webp nmbrbnmbrenmbrcnmbrcbanmbrbnmbrfnmbrfnmbraacnmbr the i preprocess text remov special charact space stop word token text like http preview redd kynmbrfnmbrnruqnmbrqnmbr png width nmbr format png auto webp fnmbrfanmbrbacnmbranmbracdnmbrenmbrenmbrfnmbrc next i build vocab list like http preview redd qnmbrfnxnmbrbnmbrrnmbrqnmbr png width nmbr format png auto webp nmbraddenmbrddnmbrfdnmbrfanmbrenmbrbnmbrabnmbrcnmbr then creat pad tensor sentenc http preview redd nmbrmnmbrvanmbrvrnmbrqnmbr png width nmbr format png auto webp dnmbrbnmbrfenmbrdanmbrenmbrdenmbrdcnmbrfbbnmbrdanmbrdnmbrc afterward creat data gener appli train evalu http preview redd nmbrmzlnmbrytisnmbrqnmbr png width nmbr format png auto webp nmbrbnmbrfnmbranmbrcnmbrdnmbrenmbrfnmbreenmbr http preview redd nmbrfnmbrmnmbrksnmbrqnmbr png width nmbr format png auto webp nmbranmbraanmbrenmbrenmbrenmbreaenmbrfcnmbrdenmbrdnmbrcnmbr http preview redd xknmbrunmbrrrlsnmbrqnmbr png width nmbr format png auto webp dnmbrbnmbrcnmbrfnmbrbfnmbrenmbrfnmbrfnmbrfnmbranmbr http preview redd thqavnmbritsnmbrqnmbr png width nmbr format png auto webp nmbrfnmbreanmbrfafdnmbrdeanmbrednmbranmbrbdnmbr http preview redd wnmbrdnmbryxsnmbrqnmbr png width nmbr format png auto webp nmbrcdbnmbrdbfdfnmbrfnmbradfnmbranmbrcnmbraenmbrf i start creat layer forward propag one layer next neigh relu activ function http preview redd hbnmbrczcgftnmbrqnmbr png width nmbr format png auto webp nmbredfbnmbranmbrbnmbrfenmbrcanmbrenmbrcanmbrdbnmbrenmbrenmbrecbf defin dens layer http preview redd rfysjtnmbrptnmbrqnmbr png width nmbr format png auto webp nmbrfnmbrcnmbraefdeanmbrbecnmbrcfnmbrbnmbrfbd http preview redd mmkspnmbrqtnmbrqnmbr png width nmbr format png auto webp nmbrcnmbrfnmbrdnmbrdbnmbrbnmbrenmbraenmbrbaenmbrfnmbr the next step defin model use trax combin layer http preview redd nmbrgnmbrcnmbracunmbrqnmbr png width nmbr format png auto webp anmbrbnmbraecefnmbrenmbrdenmbrafnmbrbnmbref http preview redd nmbrswtlcnmbrdunmbrqnmbr png width nmbr format png auto webp nmbrfnmbrcnmbrfnmbrbnmbrdcfenmbrfacnmbrbdnmbrbdefebnmbrab i creat train evalu loop help us understand model perform http preview redd pnmbrpnmbrghyiunmbrqnmbr png width nmbr format png auto webp nmbrfenmbranmbrcnmbrdnmbrbfnmbrdnmbrabdnmbranmbrcadnmbrdnmbrfenmbrcnmbr next check model accuraci i know pretti low current learn student look improv excit feedback help improv model http preview redd nmbrxcgvnmbrgnmbrvnmbrqnmbr png width nmbr format png auto webp nmbrenmbrabnmbrfbnmbranmbrenmbrfnmbrbfnmbranmbrbnmbrbnmbrenmbrednmbr http preview redd gnmbrhqesznmbrvnmbrqnmbr png width nmbr format png auto webp nmbreanmbranmbrbnmbrcfnmbranmbrenmbrfnmbrcnmbrdbnmbrdnmbr as see model perform nmbr the follow code i need help i tri print observ sentenc follow predict i tri get nmbr output predict angri happi label the purpos help understand custom either angri happi bot custom experi also identifi interfer need agent http preview redd kajgcwtwvnmbrqnmbr png width nmbr format png auto webp anmbrbnmbrcdnmbrdaanmbrcnmbrenmbrcnmbrcnmbrbbnmbr instead get nmbr predict label output look like i would greatli appreci help welcom ml mentor project thank look everyon wait hear
weifz,MachineLearning,1617781633.0,[D] How to define Pearl's causality in time series ?,hi recent i studi granger causal pearl causal i wonder way defin pearl causal time seri relationship granger pearl differ thank lot
PytonRzeczny,MachineLearning,1616604232.0,[D] Wasserstein GAN math,hi could you recommend resourc learn math includ wgan paper read think understand titl paper i want implement without know go loss function quit useless
AerysSk,MachineLearning,1619271507.0,"[D] ML researchers of Reddit, what qualifications do you seek in a research applicant that you have not met?",i third year undergradu cs student recent i appli research train role similar googl brain ai resid compani requir strong math program skill adequ english commun skill countri major languag english to surpris interview postdoc research top us univers i disclos seem like work compani the nmbr hour interview schedul next week met real life dear ml research qualif seek applic what question ask expect answer
bendee983,MachineLearning,1620405956.0,[R] AttendSeg: super-compact NN for semantic segmentation for edge devices,a new neural network develop research darwinai univers waterloo make possibl run semant segment resourc constrain edg devic key highlight model nmbr million param comparison refinenet nmbrm param precis reduc nmbr bit without signific compromis accuraci reduc size model nmbrmb refinenet nmbrmb attendseg use attent condens provid compact self attent the model gener use gener synthesi ml techniqu explor constraint space provid engin accuraci model size etc creat best model attendseg present cvpr june read stori interview u waterloo professor co author alex wong http bdtechtalk com nmbr nmbr nmbr attendseg deep learn edg semant segment http bdtechtalk com nmbr nmbr nmbr attendseg deep learn edg semant segment full paper http arxiv org ab nmbr http arxiv org ab nmbr
AleksanderPet,MachineLearning,1616496675.0,[R] MDMMT: Multidomain Multimodal Transformer for Video Retrieval,the research team lomonosov moscow state univers cooper intellig system data scienc lab moscow huawei r d center develop novel multi modal multi domain textnmbrvideo system outperform current state art result e g googl facebook wide use public dataset msr vtt lsmdc video retriev task paper http arxiv org ab nmbr http arxiv org ab nmbr comparison paperwithcod other msr vtt http paperswithcod com sota video retriev msr vtt msr vtt nmbrka split http paperswithcod com sota video retriev msr vtt nmbrka lsmdc http paperswithcod com sota video retriev lsmdc updat nmbrth fo april nmbr share model test script provid number paper refin list remov train test intersect scientif commun pleas refer github http github com papermsucod mdmmt
vector_machines,MachineLearning,1617491149.0,[D] Resources for crowdsourcing MCQ based dataset,i want crowdsourc dataset mcq format given sentenc user requir pick right option nmbr i explor mechan turk seem templat nlp one gener requir hardcod label thi mean i creat custom one from last emnlp i recal crowdaq bit close form i want learn cost effici crowdsourc option know want spend lot time read doc api ani suggest advic experi appreci
argh_usernametaken,MachineLearning,1618393674.0,[Discussion] which NN architecture is best suitable for analysing the structural data of biomolecules,i tri extract mean structur data biomolecul like protein which ml method appli type data
WigglyHypersurface,MachineLearning,1620230052.0,[D] Making sense of this autoencoder archetecture,i look implement architectur paper http arxiv org pdf nmbr pdf imput miss data i confus coupl point choic made rather encod decod setup autoencod add extra gener network i troubl pars necessari desir though also i confus input gener is input nois mask also input encod handl miss e replac na zero if i understand correctli miss data imput case mask use loss function zero log likelihood valu data miss is correct it seem like would simpler standard encod decod setup initi fill miss data random valu resampl predict miss valu end epoch keep train log likelihood miss valu mask that way need mask addit input encod gener
techsucker,MachineLearning,1617727196.0,[N] Facebook AI Introduces A New Self-Supervised Learning Framework For Model Selection And Hyperparameter Tuning For Large-Scale Forecasting,research facebook ai recent releas new self supervis learn framework model select ssl ms hyperparamet tune ssl hpt provid accur forecast less comput time resourc the ssl hpt algorithm estim hyperparamet nmbr nmbrx faster compar baselin search base algorithm produc accur forecast result numer applic at present forecast one signific data scienc machin learn task perform therefor crucial fast reliabl accur forecast result larg amount time seri data manag variou busi time seri analysi use find trend forecast futur valu a slight differ hyperparamet type analysi could lead differ forecast result given model seriou consequ therefor essenti select optim hyperparamet valu summari http www marktechpost com nmbr nmbr nmbr facebook ai introduc new self supervis learn framework model select hyperparamet tune larg scale forecast http www marktechpost com nmbr nmbr nmbr facebook ai introduc new self supervis learn framework model select hyperparamet tune larg scale forecast paper http arxiv org ab nmbr http arxiv org ab nmbr facebook sourc http ai facebook com blog larg scale forecast self supervis learn framework hyper paramet tune http ai facebook com blog larg scale forecast self supervis learn framework hyper paramet tune
Lunavahid,MachineLearning,1620639107.0,[Vault] [Discussion] Is Human in the Loop the New Thing?,recent discuss around ai ethic goe way one concept do need human ai pipelin loop even ceo declar worri fact ai push peopl percept judgment eventu make bias so ultim question need human loop do need surpris algorithm analys outcom result check hidden bias find potenti pitfal even find pattern might use anoth ai system new frontier ai need data perform better more data better algorithm recip success sever new achiev let look one applic familiar annot tag imag annot never access there billion imag text audio video annot tag provid solid learn background aia system learn nmbr year ago challeng recogn appl number nmbr letter z the new challeng identifi spanish hous sunni day next lake the sophist need form user mean sophist annot tag learn purpos more sophist mean label annot reason need human loop increas
BrettNMartensen,MachineLearning,1618610104.0,[D] Recency versus Frequency in Prediction,a neural net built keep track recent next input symbol sequenc use predict next symbol might given familiar sequenc that expect happen last time or could built keep track frequent next symbol occur that build probabl distribut next stimuli base count experienc then use highest probabl next stimulu predict doe anyon know paper publish compar success rate two approach e recenc versu frequenc predict purpos
janimezzz,MachineLearning,1617183219.0,[N] Deep learning method for generating proteins will speed up drug development,research chalmer univers technolog sweden present way gener synthet protein use gener deep learn the new approach huge potenti develop effici industri enzym well new protein base medicin antibodi vaccin read http news cision com chalmer r uniqu ai method gener protein speed drug develop cnmbr http news cision com chalmer r uniqu ai method gener protein speed drug develop cnmbr read articl expand function protein sequenc space use gener adversari network http doi org nmbr snmbr nmbr nmbr nmbr natur machin intellig
Candid-Wishbone-692,MachineLearning,1619708153.0,[N] Call for Teachable NLP Challenge,hi i found excit teachabl nlp challeng look peopl want particip is anyon want particip all level nlp welcom teachabl nlp challeng free open everyon interest train ai all need prepar good idea dataset when nmbr nmbr nmbr nmbr nmbr nmbr nmbr nmbr edt how you need submit ai model link explan ai good exampl http forum ainetwork ai c ai showcas nmbr http forum ainetwork ai c ai showcas nmbr prize appl store gift card winner interview broadcast ai network youtub channel nmbrk subscrib to particip submit info via http form gle xfuunssnmbrheannmbrjthnmbr http form gle xfuunssnmbrheannmbrjthnmbr you receiv invit email check teachabl nlp work http forum ainetwork ai teachabl nlp use teachabl nlp nmbr http forum ainetwork ai teachabl nlp use teachabl nlp nmbr or watch nmbr minut tutori video http youtu hzujzotnmbrqznmbr http youtu hzujzotnmbrqznmbr
fernauata,MachineLearning,1620097391.0,[R] House-GAN++: A breakthrough in automated floorplan design via Relational Refinement GAN,hous gan a breakthrough autom floorplan design via relat refin gan w convolut messag pass joint work autodesk research appear cvprnmbr http www facebook com hashtag cvprnmbr __eep__ nmbr __cft__ nmbr azwymnmbrnnmbrkjnmbrspnmbrqgofqgtldlnmbrdsnnnmbrznmbrungeswnmbrqhjiikhfkkbnchxnmbrefusrxjsmjibaxsjnlpumzgnmbrkupnmbrsunmbrjcohsfxnmbrguvayxjslkcqdyvnhpivzplqitwpcurvxcoopnmbrkrzqusjwdxaedyvr __tn__ nk r the video show interact browser demo http reddit com link nnmbrejlo video znmbrenmbrwwnmbrrnmbrxnmbr player arxiv http arxiv org ab nmbr http arxiv org ab nmbr you play around http www houseganpp com http www houseganpp com fbclid iwarnmbrynbszda ssrl_awsuofnmbrlljhnmbrnnmbrugggnmbrg unmbrs_xbvnmbrtzeqgbqnmbrcwanmbrznmbr project websit http ennauata github io houseganpp page html http ennauata github io houseganpp page html fbclid iwarnmbrsnmbrcysrvwxnnmbrcgganmbrtnmbrgrlbsrybtbtnmbrvlinmbrmbqa nmbrexnxnmbrxnmbrtxauijua
ykilcher,MachineLearning,1618408423.0,[P] Video: I built a Neural Network in Minecraft | Analog Redstone Network w/ Backprop & Optimizer (NO MODS),http youtu nmbrodhtaipfwi http youtu nmbrodhtaipfwi i built analog neural network vanilla minecraft without mod command block the network use redston wire power strength carri signal one hidden layer includ nonlinear automat backpropag even weight updat outlin nmbr nmbr intro overview nmbr nmbr redston compon explain nmbr nmbr analog multipl redston nmbr nmbr gradient descent squar root comput nmbr nmbr neural network demonstr nmbr nmbr network schema explain nmbr nmbr the network learn datapoint nmbr nmbr outro conclus i built seri live stream want thank everyon help cheer chat world save http github com yk minecraft neural network http github com yk minecraft neural network game http www minecraft net http www minecraft net multipli inspir http www youtub com channel uclmzknmbrtlnlxcxchcjujenmbrag http www youtub com channel uclmzknmbrtlnlxcxchcjujenmbrag
human_treadstone,MachineLearning,1616807524.0,[D] Choosing correct baseline model for Metric learning,i use match prototyp network perform singl shot learn ssd dataset but i want implement baselin keep track improv i think nmbr nearest neighbour baselin is good baselin i could find github implement nmbr nn ssd case alreadi baselin implemet pleas point resourc
Yuqing7,MachineLearning,1619711797.0,[R] Toward a New Generation of Neuromorphic Computing: IBM & ETH Zurich's Biologically Inspired Optimizer Boosts FCNN and SNN Training,ibm eth zurich research make progress reconcil neurophysiolog insight machin intellig propos novel biolog inspir optim artifici ann spike neural network snn incorpor synapt integr principl biolog grape group respons adjust propag error signal lead improv train time converg accuraci scalabl ann snn here quick read toward new gener neuromorph comput ibm eth zurich biolog inspir optim boost fcnn snn train http syncedreview com nmbr nmbr nmbr deepmind podrac tpu base rl framework deliv except perform low cost nmbr the paper learn deep neural network use biolog inspir optim arxiv http arxiv org pdf nmbr pdf
SuperFX,MachineLearning,1618524699.0,[D] A100 vs. A6000 for sequence learning tasks?,doe anyon first hand experi perform differ nvidia anmbr anmbr gpu larg sequenc task e g use transform i awar benchmark lambda post wonder research group hand experi use real model done benchmark the lambda number suggest someth order nmbr speed gain price differenti nmbrx i think peopl data wholesal price would use great deal terribl i wonder hold practic i like assembl gpu server use one gpu
_sshin_,MachineLearning,1617440536.0,[D] Short blogpost about EfficientNetV2,http mlpaper com nmbr nmbr nmbr review efficientnetvnmbr smaller model faster train http mlpaper com nmbr nmbr nmbr review efficientnetvnmbr smaller model faster train
Transit-Strike,MachineLearning,1619093209.0,[D] Are we underestimating how important studying theory is?,i hear lot discuss peopl essenti say employ univers care good project prove know learn cours mean noth just go kaggl find cool project work while technic true realli undersel import theori i could open kaggl repo see everyon use leakyrelu batch norm adam so i would tempt look youtub video kaggl submiss recreat output but realli hold weight i think i tri someth similar manag build decent solut would later github repo the logic realli fail tri build someth bigger better though if stylegan exampl understand optimis process like you need know peopl use batch norm etc etc it imposs understand code otherwis and even similar project i found abl apprach nmbrx time better simpl deeplearn ai http deeplearn ai cours sure could cheat way project sound sexi novic know noth ml but learn anyth use tf nn everywher find usabl result i sure realli
OverLordGoldDragon,MachineLearning,1620238337.0,[P] Fastest wavelet transforms in Python + synchrosqueezing,ssqueezepi nmbr nmbr http github com overlordgolddragon ssqueezepi releas w benchmark cwt xnmbr faster pywavelet cpu xnmbr gpu correct stft also cpu gpu acceler synchrosqueez also see kymatio http github com kymatio kymatio sota timeseri limit data fast differenti nice lectur http youtu nmbreyureyipxg
nivter,MachineLearning,1619874458.0,[P] I created a series of YouTube videos on normalizing flows - mostly inspired from UCB's Unsupervised DL code,
dcpyro,MachineLearning,1616358255.0,[D] Is my idea of a Feature Store wrong?,should featur store part enterpris data catalog to featur store seem highli nich data catalog miss lot benefit enterpris data catalog data discoveri tool my need gener featur discover search data for exampl i dataset a b use gener featur set ab i would want know inform i search ever come across dataset a b data catalog along would benefici code git commit gener featur am i miss someth
fripperML,MachineLearning,1616589984.0,"[P] New library for performing nested cross validation, optimizing, calibrating and reporting quality of binary classification models",the titl say everyth you check http github com jaimearboleda nestedcvtrain http github com jaimearboleda nestedcvtrain it first python packag i sure mani thing could improv but find interest pleas let know i appreci lot
gtgski,MachineLearning,1619394734.0,[D] VAE but every neuron models a distribution,variat autoencod model distinct middl layer neuron activ model unit gaussian is experi everi neuron model unit gaussian so rest layer middl layer
proximauri,MachineLearning,1617872991.0,[D] Model does not learn with more classes.,hi everyon i tri train vggnmbr model dataset use transfer learn the task face recognit classif softmax i first tri train nmbr class everyth fine model converg accuraci nmbr howev i train model like nmbr class includ first nmbr ident well network learn accuraci reach nmbr percent what could reason thank
