Author,Subreddit,Date,Title,Post
SisyphusGuy,MachineLearning,1617898792.0,[D] Are there any reliable open-source out-of-the-box Face Anti-Spoofing detectors?,i look face anti spoof section http paperswithcod com task face anti spoof latest paper with code i find reliabl implement open sourc face anti spoof detector rgb imag some implement i found paper with code requir depth imag other make pre train weight avail other even make wrong pre train weight avail the one i actual use box model present good gener for project ideal i would like reliabl passiv face anti spoof detector e detector activ challeng user
dadadidi,MachineLearning,1616942192.0,"[P] Guide: Finetune GPT2-XL (1.5 Billion Parameters, the biggest model) on a single 16 GB VRAM V100 Google Cloud instance with Huggingface Transformers using DeepSpeed",i need finetun gptnmbr nmbr billion paramet model project model fit gpu so figur run deepspe gradient checkpoint reduc requir gpu memori now fit one gpu here explain setup command get run http github com xirid finetun gptnmbrxl http github com xirid finetun gptnmbrxl i also abl fit current largest gpt neo model nmbr b paramet one nmbr gb vram gpu finetun think might issu huggingfac implement i hope help peopl also want finetun gptnmbr want set distribut train
mroc_lak,MachineLearning,1616579417.0,[D] How does one test for shortcut learning of deep neural networks in computer vision?,hi i come across review covid nmbr diagnosi base chest x ray mani studi flaw some learn shortcut e g use hospit specif token imag how one systemat test neural net use shortcut
jafioti,MachineLearning,1617299891.0,[D] Adaptive Computation Time Uses?,i read paper adapt comput time http arxiv org ab nmbr http arxiv org ab nmbr alex grave ago i play around basic question use the mainstream project i seen albert one version use adapt comput time determin number copi layer run it seem like would huge import allow iter refin specul output like mani network dynam number time decid network origin implement rnn i think pretti trivial implement architectur i would sure think could implement mixtur expert model model rerun layer choos differ expert time could allow big paramet space without constrain use one two expert forward pass mayb i overhyp act realli use reason seen widespread adopt
goktugkt,MachineLearning,1618608106.0,[P] Minimal PyTorch Library for Natural Evolution Strategies,http github com goktugnmbr ne torch my main goal project test new configur system librari pipc http github com goktugnmbr pipc see practic write librari also act exampl pipc it also support mpinmbrpi without chang anyth run script mpirun train parallel
Yuqing7,MachineLearning,1618587259.0,[N] ETH Zurich & UC Berkeley Method Automates Deep Reward-Learning by Simulating the Past,a research team eth uc berkeley propos deep reward learn simul past deep rlsp algorithm repres reward directli linear combin featur learn self supervis represent learn enabl agent simul human action backward time infer must done here quick read eth zurich uc berkeley method autom deep reward learn simul past http syncedreview com nmbr nmbr nmbr eth zurich uc berkeley method autom deep reward learn simul past the paper learn what to do simul past arxiv http arxiv org pdf nmbr pdf
BRadoslaw,MachineLearning,1620071706.0,[D] Transformer Positional Embeddings for the nth time - are the representations unique?,hi i tri get intuit behind posit embed describ famou paper attent need http arxiv org ab nmbr it make total sens i notic one caveat i make case particular token word posit x might result vector anoth word anoth posit let make case representation_nmbr token learn positional_embed posit nmbr representation_nmbr token positional_embed posit nmbr representation_nmbr representation_nmbr it would mean word represent uniqu if model learn sequenti natur input is case valid http kazemnejad com blog transform _architectur _posit _encod http preview redd tjrnmbrziednywnmbr png width nmbr format png auto webp nmbrebnmbranmbranmbrdnmbrbadnmbrdnmbrfnmbrdnmbr
limarg,MachineLearning,1618568522.0,[D] Marginal Likelihood Estimation based on VAE,whi margin likelihood estim propos vae base import sampl i would expect straightforward way estim margin likelihood base import sampl 𝑝 𝑥 𝑧𝑝 𝑧 𝑝 𝑥 𝑧 𝑞 𝑧 𝑥 𝑞 𝑧 𝑥 𝑑𝑧 𝔼 𝑞 𝑧 𝑥 𝑝 𝑥 𝑧 𝑝 𝑧 𝑞 𝑧 𝑥 howev nmbr origin vae paper author suggest differ method appendix d base import sampl is good reason nmbr the author furthermor suggest estim 𝑞 𝑧 𝑥 densiti estim draw sampl whi necessari know 𝑞 𝑧 𝑥 explicitli
mistermysterioyster,MachineLearning,1617448235.0,[D] Paper Reading Group #016 - Tackling climate change with machine learning. (Link to full slides in comments!),
yaxu,MachineLearning,1617265002.0,[D] Non-automated machine learning?,machin learn bit unfathom peopl what machin learn ai algorithm reason work paper is way understand ann get nmbr peopl togeth exchang number adjust state is way machin learn without machin i guess lot system complex work scale but would interest least de autom least part machin learn system kid learn sort algorithm like bubblesort school stand line follow algorithm is anyth like possibl ml algorithm
Tuba202,MachineLearning,1617219025.0,My fork of RameenAbdal's StyleFlow! [P],for know styleflow super cool ai http youtu ltnmbrznmbrooaeey edit facial paramet like age gender the issu run after week work i final got work decid share work form fork project my styleflow fork http github com tubanmbr styleflow made easi as long window comput cuda compat gpu pleas take time check an exampl http preview redd nmbrlhtfnmbreqnmbrfqnmbr png width nmbr format png auto webp bnmbrdnmbrecdcnmbranmbrdfadnmbrfenmbrbnmbrdbnmbranmbrenmbrfenmbrb
Vegetable_Ganache_37,MachineLearning,1616679356.0,[R] New Pre-Print: Bio-Inspired Robustness: A Review,hello everyon we recent ad new pre print human visual system inspir compon help adversari robust we studi recent attempt area analyz properti evalu criteria robust pleas let us know think paper feedback highli appreci p s pleas forgiv word format tt tt first last time i life els latex way titl bio inspir robust a review arxiv link http arxiv org ab nmbr http co mnmbrlzbqqhew amp nmbr abstract deep convolut neural network dcnn revolution comput vision often advoc good model human visual system howev current mani shortcom dcnn preclud model human vision for exampl case adversari attack ad small amount nois imag includ object lead strong misclassif object but human nois often invis if vulner adversari nois fix dcnn taken seriou model human vision mani studi tri add featur human visual system dcnn make robust adversari attack howev fulli clear whether human vision inspir compon increas robust perform evalu novel compon dcnn often inconclus we propos set criteria proper evalu analyz differ model accord criteria we final sketch futur effort make dccn one step closer model human vision
Seankala,MachineLearning,1618615742.0,[D] If I can't reproduce the exact reported scores of a paper (1-2% difference) then is it okay to report the scores I obtained or should I copy the originally reported scores?,sorri titl littl confus i sure mani peopl experienc i refer situat take code releas author particular model set virtual environ match still reproduc exact report score by exact i refer differ mayb nmbr nmbr a particular sota baselin i use show behavior i get nmbr nmbr differ is fine use score i copi past origin report score thank
Shoulder_Feeling,MachineLearning,1619417114.0,[Project] DataTap provides droplets ( containers for datasets) to make working on popular deep learning datasets easy.,excit share datatap http www datatap dev an open sourc dataset manag tool make easi container dataset let focu machin learn data op datatap let build data set droplet think droplet docker contain data a droplet encapsul dataset easili use import share across differ team project each data droplet consist nmbr item droplet templat similar docker file specifi dataset schema dataset annot metadata media typic imag video rich media learn start use http github com zensor datatap python http github com zensor datatap python mani machin learn project use proprietari data format requir tool util written scratch accommod not slow develop substanti also increas probabl develop introduc bug code valid model perform as part datatap effort allow machin learn engin focu machin learn introduc open sourc data interchang format call droplet the data contain format call annot provid standard way describ imag datatap design data platform softwar nmbr machin learn reach media like imag audio video need special data pipelin version manag data much like mlop tool version manag model current project common dataset avail download stream nmbr line code coco open image ai food dataset larg person dataset combin vehicl dataset see full list http app datatap dev databas nmbrbnmbrecnmbra bnmbr nmbrcfnmbr banmbr nmbrenmbrcadanmbr http app datatap dev databas nmbrbnmbrecnmbra bnmbr nmbrcfnmbr banmbr nmbrenmbrcadanmbr request your ad use open sourc tool import data droplet format use exampl http zensor typeform com wxonmbrzlsn http zensor typeform com wxonmbrzlsn
s-lilo,MachineLearning,1620223692.0,[N] Call for Participation in a Shared Task about occupations detection in clinical texts,hi everyon i research text mine unit barcelona supercomput center i want share inform meddoprof share task current organ focus detect normal profess employ statu clinic text spanish even type entiti might seem realli nich everi day learn import just think someon occup radic impact physic mental health habit lifestyl choic there even entir medic specialti occup medicin center around topic in context current pandem mani peopl specif occup special affect instanc health profession essenti worker the detect term help research better character health risk specif occup outsid medicin forese system result meddoprof may use field social care human resourc legal nlp even gender studi person i think one main contribut task inclus employ statu broad sens we annot unemploy retir peopl famili caregiv peopl homeless peopl depend govern subsidi etc strengthen social side project addit mention corpu includ nmbr document nmbr differ medic specialti normal either european skill compet qualif occup classif esco snome ct these multilingu vocabulari hope might inspir similar task languag best knowledg similar task yet we releas train set week ago june nmbrst releas test set if interest task want see annot exampl data annot guidelin pleas check task websit http temu bsc es meddoprof http temu bsc es meddoprof thank read i hope see least task
jj4646,MachineLearning,1619072260.0,"[D] is this the ""unanswered question"" of machine learning?",gener perform classifi deep learn recent becom subject intens studi deep model typic heavili parametr tend fit train data exactli despit overfit perform well test data phenomenon yet fulli understood sourc http proceed mlr press vnmbr belkinnmbra belkinnmbra pdf http proceed mlr press vnmbr belkinnmbra belkinnmbra pdf what consensu question statist commun is equival big bang dinosaur go extinct question statist machin learn commun is fundament imposs answer question extrem difficult my naïv answer question e deep learn model gener well unseen data a unseen data appar level well repres complex e g non linear combin seen data deep learn model good recogn figur complex combin b show nmbr closest friend i tell level data probabl display nearest neighbor principl big complex data set small pocket homogen data model use step stone gener thi cours explain mathemat deep learn model abl gener unseen data basic essenc matter deep learn model abl gener unseen data level unseen data similar seen data a silli extrem exampl unlik even strongest recurr neural network provid data certain stock nmbr nmbr would abl predict today weather data fundament differ allow even best model gener or suppos want use regular statist model predict inform normal distribut variabl certain mean standard deviat drastic chang mean standard deviat variabl ask previous train model continu make predict assum model know anyth chang natur expect predict less accur statist model matter great abl gener unseen data long unseen data come ballpark seen data am i understand correctli
RandomTensor,MachineLearning,1618938639.0,[N] Workshop on the Theory of Overparameterized Machine Learning **Going on right now!!**,just fyi workshop theori overparameter machin learn topml happen right lot big name hard hit talk fascin phenomenon registr free although i sure still open http topml rice edu http topml rice edu
universome,MachineLearning,1618499655.0,[P] Aligning Latent and Image Spaces to Connect the Unconnectable,hi want share latest project infinit imag gener http universom github io ali http universom github io ali the method work without condit learn dataset unrel squar imag http reddit com link mrgrdn video nmbrapkxnmbrasctnmbr player basic work follow way we put latent code posit coordin grid imag pixel locat comput pixel interpol nearbi latent code dure train gener frame random posit coordin grid feed discrimin at test time allow us produc imag posit infinit plane stitch seamlessli one anoth our gener comput imag independ patch like cocogan http arxiv org ab nmbr less extrem version inr gan http arxiv org ab nmbr cip http arxiv org ab nmbr independ pixel level thi technic tweak coordin embed make period spatial equivari shift coordin output imag shift accordingli pixel valu common coordin equal numer precis illustr 𝛿 valu coordin shift pixel valu insid circl equal differ gener numer precis http preview redd nmbrwbquwfgsctnmbr jpg width nmbr format pjpg auto webp bnmbrenmbrffecnmbranmbranmbrcdabanmbrbnmbrfnmbranmbrebfnmbrd a surpris thing approach work dataset natur landscap spatial invari imag statist also extent lsun bedroom difficult dataset infinit imag gener wall close object they make hard imposs extrapol imag left right sinc dataset pictur wall close object middl model nowher learn knowledg result lsun bedroom http preview redd ugyrknposctnmbr jpg width nmbr format pjpg auto webp nmbrenmbrcnmbrbnmbrcnmbrfnmbranmbrdnmbrafcnmbranmbracnmbrc besid also collect preprocess high qualiti dataset nmbrk landscap imag landscap hq unsplash flickr releas soon drawback approach gener patch complet independ limit gener qualiti nmbr experi moreov due patchwis gener model learnt ignor nois inject power tool imag edit also happen inr gan cip not dataset connect for lsun bedroom work filter away imag contain spatial invari statist see sec nmbr appendix c for ffhq imagenet i imagin work see studi tabl nmbr nmbr appendix c project page http universom github io ali http universom github io ali code http github com universom ali http github com universom ali paper http arxiv org ab nmbr http arxiv org ab nmbr
pmp-dash1,MachineLearning,1619732343.0,[R] Improving ETA Prediction Accuracy for Long-tail Events - Doordash ML Blogpost,if interest improv accuraci long tail event ml model check blog articl i wrote make doordash deliveri eta nmbr accur some order take longer expect arriv ad key histor real time featur mix iter custom loss function improv accuraci predict overal custom experi check technic detail learn long tail predict problem link http doordash engin nmbr nmbr nmbr improv eta predict accuraci long tail event machinelearn http www linkedin com feed hashtag keyword machinelearn highlightedupdateurn urn nmbrali nmbraactiv nmbranmbr datasci http www linkedin com feed hashtag keyword datasci highlightedupdateurn urn nmbrali nmbraactiv nmbranmbr eta http www linkedin com feed hashtag keyword eta highlightedupdateurn urn nmbrali nmbraactiv nmbranmbr map http www linkedin com feed hashtag keyword map highlightedupdateurn urn nmbrali nmbraactiv nmbranmbr logist http www linkedin com feed hashtag keyword logist highlightedupdateurn urn nmbrali nmbraactiv nmbranmbr
amasterblaster,MachineLearning,1619128441.0,[Discussion] Any new / good hyperparam tuning approaches?,i look tune slow function one call take nmbr min nmbrhr how guy handl optim someth slow have good advanc new librari problem i feel like techniqu i use suck look see everyon
grid_world,MachineLearning,1617182279.0,[R] Dataset for research paper,i process publish paper deep learn compress compar model origin size perform vs compress size perform dataset major research paper either focu cifar nmbr imagenet imagenet becom infrastructur challeng sinc dataset size upward nmbr gb the problem cifar nmbr smaller dataset nmbrk imag scale well model size grow think resnet nmbr bigger therefor suggest dataset sit somewher whose result accept journal confer etc academ point view
regalalgorithm,MachineLearning,1619187929.0,[D] Your Favorite AI Podcasts / Blogs / Newsletters / YouTube Channels?,hi i want write littl blog post summar differ way keep ai way podcast blog newslett youtub channel yeah million well curat miss lot stuff date criteria still activ focus primarili ai high qualiti here i far would appreci suggest addit podcast machin learn street talk http www youtub com channel ucmltbahinmbrdmrtnmbrnpvdsoirq lex fridman mainli first nmbr ep gigaom voic ai data skeptic eye ai gradient dissent robot brain re work podcast ai today podcast chat time data scienc let talk ai in machin we trust public the gradient toward data scienc analyt vidhya distil person blog lil log http lilianweng github io lil log gwern sebastian ruder alex irpan chri olah democrat autom approxim correct off convex path arg min blog i bandit academ blog sail blog berkeley ai blog machin learn berkeley blog cmu ml blog ml mit ml georgia tech googl facebook salesforc microsoft baidu openai deepmind journalist karen hao cade metz will knight khari johnson newslett last week ai batch ai sebast ruder artifici intellig weekli new wire ai newslett paper code the algorithm ai weekli weekli robot import ai deep learn weekli h weekli chinai newslett the europeanai newslett youtub channel talk amii intellig http www youtub com channel ucxxisinvrnmbrupxvnmbryuhsgdba cmu ai seminar http www youtub com channel uclhnmbroumbgenmbrwpyvziinmbrng robot institut seminar seri http www youtub com playlist list plcfdnmbrbcnmbrfenmbrdf machin learn center georgia tech http www youtub com channel ucuginmbrcnmbrsnmbr yvinmbrkfdkdunmbraw video robot today http www youtub com channel uctfixxnmbrnjnmbrqz zxgewdcynmbra stanford mlsi seminar http www youtub com channel uczznmbrructabnmbrunmbrqpinmbrhpzeq mit embodi intellig http www youtub com channel ucnxgbvgunmbrinmbrkofooncaw interview see podcast paper summari ai coffe break letitia http www youtub com c aicoffeebreak featur henri ai lab http www youtub com channel uchbnmbrvepynmbrkyvzjjnmbrbgxnpbw yannic kilcher http www youtub com channel uczhmqknmbrmsjgfcctnnmbrxbfew arxiv insight lesson nmbrbluenmbrbrown http www youtub com c nmbrbluenmbrbrown featur jordan harrod http www youtub com channel ucnmbrhnmbrnwntgnmbrxinmbrptnmbrykvsha vcubingx http www youtub com channel ucvnmbrnfnmbrzwevessvcmznmbrmlwnmbra leo isikdogan http www youtub com channel uc yaxubpanmbrhvryfjbkfncja demo bycloud http www youtub com channel ucgfenmbroozdnmbrvjpbnmbrajanuqng two minut paper http www youtub com channel ucbfypyitq nmbrlnmbrupoxnmbrnvctg code bullet http www youtub com channel ucnmbrenmbrqhiyukixghnmbrvvpkhhnmbrq what ai http www youtub com c whatsai video
New_Date5540,MachineLearning,1618921283.0,[P] I have created a script to convert video into slides (ppt) for StatQuest,i wonder i get slide video content awesom i decid creat script extract slide video use opencv gener ppt slide you check code ani feedback would highli appreci repo http github com ninjakx youtub videonmbrppt
VerySecretCactus,MachineLearning,1618782264.0,"[D] Is the ""Super Harsh Guide to ML"" reddit post out of date yet? (2021 version)",last time post year ago wonder anyth chang origin post http www reddit com r machinelearn comment nmbrznmbr d_a_super_harsh_guide_to_machine_learn last year updat http www reddit com r machinelearn comment emmxpnmbr d_is_the_super_harsh_guide_to_ml_reddit_post_out
L-MK,MachineLearning,1620290611.0,[R] Do You Even Need Attention? A Stack of Feed-Forward Layers Does Surprisingly Well on ImageNet,tl dr got scoop mlp mixer i releas writeup code model i hope someon find interest use late i tri coupl variant simpl vision transform better understand make perform well about month ago i found could replac attent layer feed forward layer get quit good result last week i start short writeup experi page i see full paper today googl put paper mlp mixer propos exactli architectur when i saw paper earlier today i consid scrap i done i figur i might well put for interest github repo http github com lukemela even need attent pretrain model w b log http wandb ai lukemelasnmbr deit experi report do you even need attent vmlldzonmbrnjuxmzi accesstoken nmbrkebvweuenmbrgdnmbrsnmbrqiavnmbrorconmbrvnmbrglogsinmbrinmbrjnmbrbbnmbrgnmbrenmbrpxnmbrlkknmbrzu experi nmbr page writeup http github com lukemela even need attent blob main do you even need attent pdf also anyon stori get scoop feel free share i imagin peopl crazi stori edit wow thank support i realli expect base suggest i also upload version report arxiv http arxiv org ab nmbr http arxiv org ab nmbr
patrickkidger,MachineLearning,1617795134.0,"[P] torchtyping -- documentation + runtime type checking of tensor shapes (and dtypes, ...)",hello everyon i excit announc torchtyp http github com patrick kidger torchtyp way document check pytorch tensor correct shape dtype name layout turn def batch_outer_product x torch tensor torch tensor torch tensor x shape batch x_channel shape batch y_channel return shape batch x_channel y_channel return x unsqueez nmbr unsqueez nmbr def batch_outer_product x tensortyp batch x_channel tensortyp batch y_channel tensortyp batch x_channel y_channel return x unsqueez nmbr unsqueez nmbr runtim check size channel line consist bye bye bug say hello enforc clear document code person i find i leav comment shape tensor code keep track function expect torchtyp design fix check document github http github com patrick kidger torchtyp usag exampl way extend torchtyp final curiou look torchtyp faq librari similar thing e g jax torchtyp quit option
Transit-Strike,MachineLearning,1616942574.0,[D] Does Dataset balance matter for a Style GAN?,when look classifi class nmbr domin class nmbr a lot sampl realli hurt accuraci model sinc strong bia toward one class our model blindli assum sampl class nmbr would right often with style gan i look i fear i similar issu i need convert photo fake paint i would say easi i lot photo paint would someth like affect binari cross entropi i think would sinc one class better repres but time sinc fake imag gener base real imag could ensur gener number fake imag number real imag class if nmbr paint gener nmbr fake paint the number photo may may matter i sure but case would wasserstein loss bce help mitig issu sinc care distribut class label
jj4646,MachineLearning,1619072295.0,[D] why did kernel methods become less popular than neural networks?,i read today earlier neural network popular choic activ function neural network radial basi function rbf thi appar earlier neural network call kernel approxim thi bit surpris see peopl right away assum popular choic activ function neural network relu it seem transit away rbf activ function happen around time neural network overtook svm term popular doe anyon know happen i read neural network rbf function also along standard neural network univers approxim properti e theoret abl approxim target function level accuraci effici anoth question is reason rbf lost popular doe anyon know relu go activ function neural network day just guess perhap neural network relu activ abl better consist converg approxim target function compar rbf given resourc e g number neuron layer thank
zhangboknight,MachineLearning,1617946769.0,[P] Colorizing the legacy videos with attention mechanism,we recent releas code paper deep exemplar base video color the code along colab demo avail http github com zhangmozh deep exemplar base video color http github com zhangmozh deep exemplar base video color welcom tri http preview redd qsxnmbramqnmbrsnmbr png width nmbr format png auto webp nmbreeenmbrcenmbrdbnmbrcnmbrfnmbrcfnmbrbnmbrfnmbrdefnmbrdnmbrf youtub demo avail http youtub com watch v hxwrnmbrhnmbrvvyi featur share http youtub com watch v hxwrnmbrhnmbrvvyi featur share
rafcy,MachineLearning,1617542304.0,[P] Object Detection and Tracking,share project github sinc version publish codeocean well note chang darknet yolo train weight yolo detector use repositori detector tracker object choic languag python project refer paper http arxiv org ab nmbr http arxiv org ab nmbr also ieee public found repo descript github repositori http github com rafci harpytm http github com rafci harpytm brief descript the main purpos applic extract traffic data vehicl road use aerial footag taken static uav to process footag deep neural network detector use yolo alongsid opencv librari order execut python furthermor multipl algorithm use kalman hungarian order match detect sequenti frame extract vehicl trajectori henc veloc move direct vehicl also calcul vehicl everi frame you free discuss suggest improv featur
